{"checkout":"__CHECKOUT__","gitCommitSha":"0123456789abcdef0123456789abcdef01234567","hosts":[{"afterDigest":"1d1f165454eaee712fb45272b708c850b54804c0df28d5f30325cea702263130","beforeDigest":null,"cacheRoot":"__CODEX_CACHE__","host":"codex","marketplacePaths":[],"mismatches":[],"registryPath":null,"status":"refreshed"},{"afterDigest":"1d1f165454eaee712fb45272b708c850b54804c0df28d5f30325cea702263130","beforeDigest":"3fc9ba4de2757180554c92f93181c189346f7579a6db2261b55f76905fb64ef5","cacheRoot":"__CLAUDE_CACHE__","host":"claude","marketplacePaths":[],"mismatches":[],"registryPath":"__CLAUDE_REGISTRY__","status":"refreshed"},{"afterDigest":"1d1f165454eaee712fb45272b708c850b54804c0df28d5f30325cea702263130","beforeDigest":null,"cacheRoot":"__ZCODE_CACHE__","host":"zcode","marketplacePaths":["__ZCODE_MARKETPLACE_FILE__","__ZCODE_CLAUDE_MARKETPLACE_FILE__"],"mismatches":[],"registryPath":"__ZCODE_REGISTRY__","status":"refreshed"}],"mismatchCount":0,"ok":true,"version":"0.36.0"}
